"Status","Start Time","Stop Time","Duration in ms","Parent Suite","Suite","Sub Suite","Test Class","Test Method","Name","Description"
"passed","Mon Jan 30 19:11:45 GMT 2023","Mon Jan 30 19:11:46 GMT 2023","396","","Контрактные тесты ReqRes:","","Контрактные тесты ReqRes:","Проверка схемы ответа регистрации пользователя","Проверка схемы ответа регистрации пользователя",""
"passed","Mon Jan 30 19:11:47 GMT 2023","Mon Jan 30 19:11:47 GMT 2023","239","","Интеграционные тесты ReqRes:","","Интеграционные тесты ReqRes:","Попытка входа без пароля","Попытка входа без пароля",""
"passed","Mon Jan 30 19:11:46 GMT 2023","Mon Jan 30 19:11:46 GMT 2023","507","","Интеграционные тесты ReqRes:","","Интеграционные тесты ReqRes:","Создание и удаление пользователя","Создание и удаление пользователя",""
"passed","Mon Jan 30 19:11:46 GMT 2023","Mon Jan 30 19:11:47 GMT 2023","479","","Интеграционные тесты ReqRes:","","Интеграционные тесты ReqRes:","Регистрация и логин","Регистрация и логин",""
"passed","Mon Jan 30 19:11:47 GMT 2023","Mon Jan 30 19:11:47 GMT 2023","12","","Интеграционные тесты ReqRes:","","Интеграционные тесты ReqRes:","Ответ с заглушкой от мок сервера","Ответ с заглушкой от мок сервера",""
