"Status","Start Time","Stop Time","Duration in ms","Parent Suite","Suite","Sub Suite","Test Class","Test Method","Name","Description"
"passed","Mon Feb 13 20:10:11 GMT 2023","Mon Feb 13 20:10:11 GMT 2023","223","","Интеграционные тесты ReqRes:","","Интеграционные тесты ReqRes:","Попытка входа без пароля","Попытка входа без пароля",""
"passed","Mon Feb 13 20:10:10 GMT 2023","Mon Feb 13 20:10:11 GMT 2023","451","","Интеграционные тесты ReqRes:","","Интеграционные тесты ReqRes:","Регистрация и логин","Регистрация и логин",""
"passed","Mon Feb 13 20:10:10 GMT 2023","Mon Feb 13 20:10:10 GMT 2023","456","","Интеграционные тесты ReqRes:","","Интеграционные тесты ReqRes:","Создание и удаление пользователя","Создание и удаление пользователя",""
"passed","Mon Feb 13 20:10:11 GMT 2023","Mon Feb 13 20:10:11 GMT 2023","12","","Интеграционные тесты ReqRes:","","Интеграционные тесты ReqRes:","Ответ с заглушкой от мок сервера","Ответ с заглушкой от мок сервера",""
"passed","Mon Feb 13 20:10:09 GMT 2023","Mon Feb 13 20:10:10 GMT 2023","459","","Контрактные тесты ReqRes:","","Контрактные тесты ReqRes:","Проверка схемы ответа регистрации пользователя","Проверка схемы ответа регистрации пользователя",""
